A survey of app store analysis for software engineering,http://ieeexplore.ieee.org/abstract/document/7765038/,http://ieeexplore.ieee.org/iel7/32/4359463/07765038.pdf,2016,ieeexplore.ieee.org
Who you gonna call?: analyzing web requests in Android applications,http://dl.acm.org/citation.cfm?id=3104201,https://arxiv.org/pdf/1705.06629,2017,dl.acm.org
Android apps and user feedback: a dataset for software evolution and quality improvement,http://dl.acm.org/citation.cfm?id=3121266,https://pdfs.semanticscholar.org/6d7e/c7c464e27a696cf5cdac6766920d1b64405b.pdf,2017,dl.acm.org
Predicting crashing releases of mobile applications,http://dl.acm.org/citation.cfm?id=2962606,http://ink.library.smu.edu.sg/cgi/viewcontent.cgi?article=4579&context=sis_research,2016,dl.acm.org
Predicting Android application security and privacy risk with static code metrics,http://dl.acm.org/citation.cfm?id=3104109,http://dl.acm.org/citation.cfm?id=3104109,2017,dl.acm.org
How Android App Developers Manage Power Consumption?-An Empirical Study by Mining Power Management Commits,http://ieeexplore.ieee.org/abstract/document/7832885/,http://ink.library.smu.edu.sg/cgi/viewcontent.cgi?article=4564&context=sis_research,2016,ieeexplore.ieee.org
Darwin: a static analysis dataset of malicious and benign Android apps,http://dl.acm.org/citation.cfm?id=2993264,http://www.se.rit.edu/~samvse/publications/Darwin_A_Static_Analysis_Dataset_Of_Malicious_And_Benign_Android_Apps.pdf,2016,dl.acm.org
Examining the relationship between security metrics and user ratings of mobile apps: a case study,http://dl.acm.org/citation.cfm?id=2993260,http://dl.acm.org/citation.cfm?id=2993260,2016,dl.acm.org
App Store Analysis for Software Engineering,http://discovery.ucl.ac.uk/1537482/,http://discovery.ucl.ac.uk/1537482/1/App_Store_Analysis_Thesis_William_Martin.pdf,WJMartin,2017
Reliability score inference and recommendation using fuzzy-based technique for social media applications,https://link.springer.com/article/10.1007/s00500-017-2774-5,https://link.springer.com/article/10.1007/s00500-017-2774-5,2017,Springer
How do apps evolve in their permission requests?: a preliminary study,http://dl.acm.org/citation.cfm?id=3104195,http://software.imdea.org/~alessandra.gorla/papers/Calciati-PermEvolution-MSR17.pdf,2017,dl.acm.org
Machine learning classifiers for android malware analysis,http://ieeexplore.ieee.org/abstract/document/7516385/,http://ieeexplore.ieee.org/abstract/document/7516385/,2016,ieeexplore.ieee.org
Framework for malware analysis in Android,http://proesa.org.co/revistas/index.php/sistemas_telematica/article/view/2241,http://proesa.org.co/revistas/index.php/sistemas_telematica/article/viewFile/2241/2870,2016,proesa.org.co
Who added that permission to my app?: an analysis of developer permission changes in open source Android apps,http://dl.acm.org/citation.cfm?id=3104111,http://dl.acm.org/citation.cfm?id=3104111,2017,dl.acm.org
