A survey of app store analysis for software engineering,http://ieeexplore.ieee.org/abstract/document/7765038/,http://ieeexplore.ieee.org/iel7/32/4359463/07765038.pdf,2016,ieeexplore.ieee.org
Triggerscope: Towards detecting logic bombs in android applications,http://ieeexplore.ieee.org/abstract/document/7546513/,http://schmucker.ccs.neu.edu/static/publications/sp2016triggerscope.pdf,2016,ieeexplore.ieee.org
Droidra: Taming reflection to support whole-program analysis of android apps,http://dl.acm.org/citation.cfm?id=2931044,http://orbilu.uni.lu/bitstream/10993/27761/1/li2016droidra.pdf,2016,dl.acm.org
The evolution of android malware and android analysis techniques,http://dl.acm.org/citation.cfm?id=3017427,https://pure.royalholloway.ac.uk/portal/files/28069262/computingsurvey.pdf,2017,dl.acm.org
A taxonomy and qualitative comparison of program analysis techniques for security assessment of Android software,http://ieeexplore.ieee.org/abstract/document/7583740/,http://ieeexplore.ieee.org/abstract/document/7583740/,2016,ieeexplore.ieee.org
Detecting behavior anomalies in graphical user interfaces,http://dl.acm.org/citation.cfm?id=3098412,https://www.st.cs.uni-saarland.de/appmining/backstage/backstage_tech_report.pdf,2017,dl.acm.org
Toward engineering a secure android ecosystem: A survey of existing techniques,http://dl.acm.org/citation.cfm?id=2963145,http://www.cc.gatech.edu/~yjang37/assets/papers/2016/xu:android-survey.pdf,2016,dl.acm.org
A Multi-view Context-aware Approach to Android Malware Detection and Malicious Code Localization,https://arxiv.org/abs/1704.01759,https://arxiv.org/pdf/1704.01759,2017,arxiv.org
Dark Hazard: Learning-based, Large-scale Discovery of Hidden Sensitive Operations in Android Apps,http://www.cs.ucr.edu/~heng/pubs/ndss2017.pdf,http://www.cs.ucr.edu/~heng/pubs/ndss2017.pdf,HYin,2017
Contextual approach for identifying malicious Inter-Component privacy leaks in Android apps,http://ieeexplore.ieee.org/abstract/document/8024534/,http://ieeexplore.ieee.org/abstract/document/8024534/,2017,ieeexplore.ieee.org
Spam mobile apps: Characteristics, detection, and in the wild analysis,http://dl.acm.org/citation.cfm?id=3007901,https://research.csiro.au/ng/wp-content/uploads/sites/106/2017/06/TWEB_2017.pdf,2017,dl.acm.org
Mamadroid: Detecting android malware by building markov chains of behavioral models,https://arxiv.org/abs/1612.04433,https://arxiv.org/pdf/1612.04433,2016,arxiv.org
Static analysis of android apps: A systematic literature review,http://orbilu.uni.lu/handle/10993/26879,http://orbilu.uni.lu/bitstream/10993/26879/1/tr_slr_article.pdf,SRasthofer…,2016
Reflection-aware static analysis of android apps,http://ieeexplore.ieee.org/abstract/document/7582811/,http://orbilu.uni.lu/bitstream/10993/28287/1/li2016reflection.pdf,2016,ieeexplore.ieee.org
Context-aware, Adaptive and Scalable Android Malware Detection through Online Learning (extended version),https://arxiv.org/abs/1706.00947,https://arxiv.org/pdf/1706.00947,2017,arxiv.org
Context-Aware, Adaptive, and Scalable Android Malware Detection Through Online Learning,http://ieeexplore.ieee.org/abstract/document/7935482/,http://ieeexplore.ieee.org/abstract/document/7935482/,2017,ieeexplore.ieee.org
MaMaDroid: Detecting Android Malware by Building Markov Chains of Behavioral Models (Extended Version),https://arxiv.org/abs/1711.07477,https://arxiv.org/pdf/1711.07477,2017,arxiv.org
Automated Synthesis of Semantic Malware Signatures using Maximum Satisfiability,https://arxiv.org/abs/1608.06254,https://arxiv.org/pdf/1608.06254,2016,arxiv.org
Understanding the purpose of permission use in mobile apps,http://dl.acm.org/citation.cfm?id=3086677,http://www.cmuchimps.org/uploads/publication/paper/183/understanding_the_purpose_of_permission_use_in_mobile_apps.pdf,2017,dl.acm.org
Malware Detection in Adversarial Settings: Exploiting Feature Evolutions and Confusions in Android Apps,https://pdfs.semanticscholar.org/e8ff/b7f0dcd533c52523493aa3f260bb9ee57f22.pdf,https://pdfs.semanticscholar.org/e8ff/b7f0dcd533c52523493aa3f260bb9ee57f22.pdf,CAGunter,2017
ContexIoT: Towards Providing Contextual Integrity to Appified IoT Platforms,http://web.eecs.umich.edu/~jackjia/material/contexiot_ndss17.pdf,http://web.eecs.umich.edu/~jackjia/material/contexiot_ndss17.pdf,2017,eecs.umich.edu
Analysis of code heterogeneity for high-precision classification of repackaged malware,http://ieeexplore.ieee.org/abstract/document/7527778/,http://people.cs.vt.edu/danfeng/papers/IEEE-Android-partition-Yao.pdf,2016,ieeexplore.ieee.org
Audacious: User-driven access control with unmodified operating systems,http://dl.acm.org/citation.cfm?id=2978344,http://www.franziroesner.com/pdf/audacious-ccs2016.pdf,2016,dl.acm.org
Droidcat: Unified dynamic detection of Android malware,https://vtechworks.lib.vt.edu/handle/10919/77523,https://vtechworks.lib.vt.edu/bitstream/handle/10919/77523/TR-17-01.pdf?sequence=1,DYao,2016
Challenges for static analysis of Java reflection: literature review and empirical study,http://dl.acm.org/citation.cfm?id=3097429,http://www.win.tue.nl/~aserebre/ICSE2017.pdf,2017,dl.acm.org
Characterizing malicious Android apps by mining topic-specific data flow signatures,http://www.sciencedirect.com/science/article/pii/S095058491730366X,http://ink.library.smu.edu.sg/cgi/viewcontent.cgi?article=4677&context=sis_research,2017,Elsevier
Auditing anti-malware tools by evolving android malware and dynamic loading technique,http://ieeexplore.ieee.org/abstract/document/7837653/,http://www.ntu.edu.sg/home/yangliu/publications/journal/tifs_final.pdf,2017,ieeexplore.ieee.org
Semantic modelling of android malware for effective malware comprehension, detection, and classification,http://dl.acm.org/citation.cfm?id=2931043,http://dl.acm.org/citation.cfm?id=2931043,2016,dl.acm.org
Toward Automatically Generating Privacy Policy for Android Apps,http://ieeexplore.ieee.org/abstract/document/7782398/,http://www4.comp.polyu.edu.hk/~csxluo/AutoPPG.pdf,2017,ieeexplore.ieee.org
Static analysis of android apps: A systematic literature review,http://www.sciencedirect.com/science/article/pii/S0950584917302987,https://orbilu.uni.lu/bitstream/10993/31636/1/li2017static.pdf,2017,Elsevier
Android resource usage risk assessment using hidden Markov model and online learning,http://www.sciencedirect.com/science/article/pii/S0167404816301596,http://www.sciencedirect.com/science/article/pii/S0167404816301596,2017,Elsevier
Code relatives: Detecting similarly behaving software,http://dl.acm.org/citation.cfm?id=2950321,https://pdfs.semanticscholar.org/ba10/b95ae2c6fe8d1f7a0c07c00dd0c652757e4f.pdf,2016,dl.acm.org
DroidContext: Identifying Malicious Mobile Privacy Leak Using Context,http://ieeexplore.ieee.org/abstract/document/7847025/,http://ieeexplore.ieee.org/abstract/document/7847025/,2016,ieeexplore.ieee.org
Contextual Weisfeiler-Lehman graph kernel for malware detection,http://ieeexplore.ieee.org/abstract/document/7727817/,https://arxiv.org/pdf/1606.06369,2016,ieeexplore.ieee.org
Mystique: Evolving Android malware for auditing anti-malware tools,http://dl.acm.org/citation.cfm?id=2897856,http://dl.acm.org/citation.cfm?id=2897856,2016,dl.acm.org
Android malware detection using complex-flows,http://ieeexplore.ieee.org/abstract/document/7980206/,http://cs.ucf.edu/~mohaisen/doc/17-icdcs-android.pdf,2017,ieeexplore.ieee.org
Adaptive and scalable android malware detection through online learning,http://ieeexplore.ieee.org/abstract/document/7727508/,https://arxiv.org/pdf/1606.07150,2016,ieeexplore.ieee.org
Addressing problems with replicability and validity of repository mining studies through a smart data platform,https://link.springer.com/article/10.1007/s10664-017-9537-x,https://link.springer.com/article/10.1007/s10664-017-9537-x,2017,Springer
Feature Selection to Mine Joint Features from High-dimension Space for Android Malware Detection.,http://search.ebscohost.com/login.aspx?direct=true&profile=ehost&scope=site&authtype=crawler&jrnl=19767277&AN=125616458&h=Xmeu%2FKaYqcyPRl%2FirTeQkVHpRlbf8q8DK4AlGJusaIg75vkbdKoEzXplmbyp8lABc2PySEUMchkvVrOrIMbyXA%3D%3D&crl=c,http://search.ebscohost.com/login.aspx?direct=true&profile=ehost&scope=site&authtype=crawler&jrnl=19767277&AN=125616458&h=Xmeu%2FKaYqcyPRl%2FirTeQkVHpRlbf8q8DK4AlGJusaIg75vkbdKoEzXplmbyp8lABc2PySEUMchkvVrOrIMbyXA%3D%3D&crl=c,2017,search.ebscohost.com
Analyzing Android Repackaged Malware by Decoupling Their Event Behaviors,http://link.springer.com/chapter/10.1007/978-3-319-44524-3_1,http://link.springer.com/chapter/10.1007/978-3-319-44524-3_1,2016,Springer
Lightweight, obfuscation-resilient detection and family identification of android malware,http://seal.ics.uci.edu/publications/2017_TOSEM_lightweight.pdf,http://seal.ics.uci.edu/publications/2017_TOSEM_lightweight.pdf,NEsfahani…,2016
Evaluation of android malware detection based on system calls,http://dl.acm.org/citation.cfm?id=2875487,http://soarlab.org/publications/iwspa2016-daur.pdf,2016,dl.acm.org
Causality-based sensemaking of network traffic for android application security,http://dl.acm.org/citation.cfm?id=2996760,http://dl.acm.org/ft_gateway.cfm?id=2996760&type=pdf,2016,dl.acm.org
DroidNMD: Network-based Malware Detection in Android Using an Ensemble of One-Class Classifiers,http://mjee.modares.ac.ir/article_17798_b95f19d187db60a9dc373965d292c440.pdf,http://mjee.modares.ac.ir/article_17798_b95f19d187db60a9dc373965d292c440.pdf,2017,mjee.modares.ac.ir
AMD-EC: Anomaly-based Android malware detection using ensemble classifiers,http://ieeexplore.ieee.org/abstract/document/7985436/,http://ieeexplore.ieee.org/abstract/document/7985436/,2017,ieeexplore.ieee.org
Hardening Malware Detection Systems Against Cyber Maneuvers: An Adversarial Machine Learning Approach,https://arxiv.org/abs/1706.04146,https://arxiv.org/pdf/1706.04146,2017,arxiv.org
Comparison of Different Techniques for Detecting Malware in Smartphones,http://search.proquest.com/openview/3386234d6428ddd8c1ae7aec3d492e64/1?pq-origsite=gscholar&cbl=616671,https://www.researchgate.net/profile/Muhammad_Azeem38/publication/312372047_Comparison_of_Different_Techniques_for_Detecting_Malware_in_Smartphones/links/587bc09608ae9a860fe9b91c.pdf,2016,search.proquest.com
Selecting Critical Data Flows in Android Applications for Abnormal Behavior Detection,https://www.hindawi.com/journals/misy/2017/7397812/abs/,http://downloads.hindawi.com/journals/misy/2017/7397812.pdf,2017,hindawi.com
Local-based active classification of test report to assist crowdsourced testing,http://dl.acm.org/citation.cfm?id=2970300,https://ece.uwaterloo.ca/~s446wang/paper/ase-16-2.pdf,2016,dl.acm.org
LeakSemantic: Identifying Abnormal Sensitive Network Transmissions in Mobile Applications,https://arxiv.org/abs/1702.01160,https://arxiv.org/pdf/1702.01160,2017,arxiv.org
Resolving reflection methods in Android applications,http://ieeexplore.ieee.org/abstract/document/8004892/,http://ieeexplore.ieee.org/abstract/document/8004892/,2017,ieeexplore.ieee.org
A Remote Control System for Improving the Mobile Device Security Based on SE Android,http://www.inf.cyut.edu.tw/AIT2016/paper/ft_061.pdf,http://www.inf.cyut.edu.tw/AIT2016/paper/ft_061.pdf,2016,inf.cyut.edu.tw
Revisiting the description-to-behavior fidelity in android applications,http://ieeexplore.ieee.org/abstract/document/7476662/,http://www4.comp.polyu.edu.hk/~csxluo/TAPVerifier.pdf,2016,ieeexplore.ieee.org
Classifying Android Malware with Dynamic Behavior Dependency Graphs,http://ieeexplore.ieee.org/abstract/document/7846970/,http://ieeexplore.ieee.org/abstract/document/7846970/,2016,ieeexplore.ieee.org
A deep learning approach to android malware feature learning and detection,http://ieeexplore.ieee.org/abstract/document/7846953/,http://ieeexplore.ieee.org/abstract/document/7846953/,2016,ieeexplore.ieee.org
Mlifdect: Android Malware Detection Based on Parallel Machine Learning and Information Fusion,https://www.hindawi.com/journals/scn/2017/6451260/abs/,http://downloads.hindawi.com/journals/scn/2017/6451260.pdf,2017,hindawi.com
Android App Malicious Behavior Detection Based on User Intention,http://ieeexplore.ieee.org/abstract/document/7846993/,http://ieeexplore.ieee.org/abstract/document/7846993/,2016,ieeexplore.ieee.org
App Store Analysis for Software Engineering,http://discovery.ucl.ac.uk/1537482/,http://discovery.ucl.ac.uk/1537482/1/App_Store_Analysis_Thesis_William_Martin.pdf,WJMartin,2017
Systematic discovery of Android customization hazards,http://search.proquest.com/openview/331bd2f3011e462a4371f971c280b13b/1?pq-origsite=gscholar&cbl=18750&diss=y,http://surface.syr.edu/cgi/viewcontent.cgi?article=1635&context=etd,
YAafer,2016
INSPIRED: Intention-based Privacy-preserving Permission Model,https://arxiv.org/abs/1709.06654,https://arxiv.org/pdf/1709.06654,2017,arxiv.org
A Semantic-based Analysis of Android Malware for Detection, Generation, and Trend Analysis,http://www.ntu.edu.sg/home/yangliu/publications/guozhuthesis.pdf,http://www.ntu.edu.sg/home/yangliu/publications/guozhuthesis.pdf,
GMeng,2017
Mining and characterizing hybrid apps,http://dl.acm.org/citation.cfm?id=2993263,http://dl.acm.org/citation.cfm?id=2993263,2016,dl.acm.org
Boosting Static Security Analysis of Android Apps through Code Instrumentation,http://orbilu.uni.lu/handle/10993/29387,http://orbilu.uni.lu/bitstream/10993/29387/1/thesis.pdf,
LLi,2016
Measuring the risk value of sensitive dataflow path in Android applications,http://onlinelibrary.wiley.com/doi/10.1002/sec.1746/full,http://onlinelibrary.wiley.com/doi/10.1002/sec.1746/full,2016,WileyOnlineLibrary
A Simple Face-based Mobile Security System Design for Android Phone Protection,http://search.proquest.com/openview/5632c5624361cb758d123a67363f242c/1?pq-origsite=gscholar&cbl=136216,https://pdfs.semanticscholar.org/4dd1/2e275cda156b2adad59f6ffdd04bdd052afb.pdf,2017,search.proquest.com
SneakLeak: Detecting multipartite leakage paths in Android apps,http://ieeexplore.ieee.org/abstract/document/8029452/,https://www.researchgate.net/profile/Shweta_Bhandari3/publication/319637532_SneakLeak_Detecting_Multipartite_Leakage_Paths_in_Android_Apps/links/59bfc182a6fdcca8e56fb406/SneakLeak-Detecting-Multipartite-Leakage-Paths-in-Android-Apps.pdf,2017,ieeexplore.ieee.org
Enhancing Accuracy of Android Malware Detection using Intent Instrumentation.,http://sharif.edu/~amini/publications/conferences/2017/MalwareDetectionByInstrumentation-ICISSP2017.pdf,http://sharif.edu/~amini/publications/conferences/2017/MalwareDetectionByInstrumentation-ICISSP2017.pdf,2017,sharif.edu
Analysis and Classification of Android Malware,https://www.royalholloway.ac.uk/isg/documents/pdf/technicalreports/2016/rhul-isg-2016-15-kimberly-tam-technical-report.pdf,https://www.royalholloway.ac.uk/isg/documents/pdf/technicalreports/2016/rhul-isg-2016-15-kimberly-tam-technical-report.pdf,
KKCTam,2016
Exploitation of Android Mobile Malware in Phishing Modus Operandi: A Malaysia Case Study,https://www.researchgate.net/profile/Natalie_Walker4/publication/310445825_Proceedings_of_The_Second_International_Conference_on_Electronics_and_Software_Science_ICESS2016_Japan_2016/links/582d5c8708ae004f74b99fb4/Proceedings-of-The-Second-International-Conference-on-Electronics-and-Software-Science-ICESS2016-Japan-2016.pdf#page=50,https://www.researchgate.net/profile/Natalie_Walker4/publication/310445825_Proceedings_of_The_Second_International_Conference_on_Electronics_and_Software_Science_ICESS2016_Japan_2016/links/582d5c8708ae004f74b99fb4/Proceedings-of-The-Second-International-Conference-on-Electronics-and-Software-Science-ICESS2016-Japan-2016.pdf#page=50,2016,researchgate.net
DroidGen: Constraint-based and Data-Driven Policy Generation for Android,https://arxiv.org/abs/1612.07586,https://arxiv.org/pdf/1612.07586,2016,arxiv.org
A Study of Selected Issues in Android Security,https://etda.libraries.psu.edu/catalog/b5644r534,https://etda.libraries.psu.edu/files/final_submissions/12546,
CRen,2016
Data Science for Software Maintenance,https://uwspace.uwaterloo.ca/handle/10012/11753,https://uwspace.uwaterloo.ca/bitstream/handle/10012/11753/Inozemtseva_Laura.pdf?sequence=3,
LMMLInozemtseva,2017
使用敏感路径识别方法分析安卓应用安全性,http://www.jos.org.cn/ch/reader/download_pdf.aspx?file_no=5177&year_id=2017&quarter_id=9&falg=1,http://www.jos.org.cn/ch/reader/download_pdf.aspx?file_no=5177&year_id=2017&quarter_id=9&falg=1,2017,jos.org.cn
Mobile App collusions and its cyber security implications,http://ieeexplore.ieee.org/abstract/document/7545916/,http://eprints.uwe.ac.uk/28712/1/Mobile%20App%20collusions%20and%20its%20cyber%20security%20implications.pdf,2016,ieeexplore.ieee.org
基于元数据的 Spam App 检测与研究,http://www.cqvip.com/qk/96111a/201609/670238714.html,http://www.cqvip.com/qk/96111a/201609/670238714.html,2016,cqvip.com
Exploring Apps Users' Experiences With App Notifications,https://dspace.library.colostate.edu/handle/10217/183919,https://dspace.library.colostate.edu/bitstream/handle/10217/183919/BombardiMount_colostate_0053N_14285.pdf?sequence=1,MRBombardi,Mount
基于 SE Android 结合远程控制提升移动系统安全性,http://www.airitilibrary.com/Publication/alDetailedMesh?docid=xaydxyxb201605001,http://www.airitilibrary.com/Publication/alDetailedMesh?docid=xaydxyxb201605001,2016,airitilibrary.com
在 Android 裝置上的動態 API 側錄與執行序列分析,http://www.airitilibrary.com/Publication/alDetailedMesh?docid=U0001-0902201709473400,http://www.airitilibrary.com/Publication/alDetailedMesh?docid=U0001-0902201709473400,2017,airitilibrary.com
移动应用安全解析学: 成果与挑战,https://web.engr.illinois.edu/~taoxie/publications/jcs16-securityanalytics.pdf,https://web.engr.illinois.edu/~taoxie/publications/jcs16-securityanalytics.pdf,2016,engr.illinois.edu
