A survey of app store analysis for software engineering,http://ieeexplore.ieee.org/abstract/document/7765038/,http://ieeexplore.ieee.org/iel7/32/4359463/07765038.pdf,2016,ieeexplore.ieee.org
HypTracker: A Hypervisor to Detect Malwares Through System Call Analysis on ARM,https://link.springer.com/chapter/10.1007/978-3-319-69471-9_15,https://link.springer.com/chapter/10.1007/978-3-319-69471-9_15,2017,Springer
Behavioral malware detection approaches for Android,http://ieeexplore.ieee.org/abstract/document/7511573/,http://ieeexplore.ieee.org/abstract/document/7511573/,2016,ieeexplore.ieee.org
App Store Analysis for Software Engineering,http://discovery.ucl.ac.uk/1537482/,http://discovery.ucl.ac.uk/1537482/1/App_Store_Analysis_Thesis_William_Martin.pdf,WJMartin,2017
Dynamic android malware classification using graph-based representations,http://ieeexplore.ieee.org/abstract/document/7545923/,http://www.dongpingzhang.com/wordpress/wp-content/uploads/2012/04/dynamic.pdf,2016,ieeexplore.ieee.org
Android malware classification using parallelized machine learning methods,http://search.proquest.com/openview/3418a8286aa3bc1f55bc6fa6b5002295/1?pq-origsite=gscholar&cbl=18750&diss=y,https://udspace.udel.edu/bitstream/handle/19716/19893/2016_XuLifan_PhD.pdf?sequence=1&isAllowed=y,LXu,2016
Machine learning based malware classification for Android applications using multimodal image representations,http://ieeexplore.ieee.org/abstract/document/7726949/,http://ieeexplore.ieee.org/abstract/document/7726949/,2016,ieeexplore.ieee.org
