A survey of app store analysis for software engineering,http://ieeexplore.ieee.org/abstract/document/7765038/,http://ieeexplore.ieee.org/iel7/32/4359463/07765038.pdf,2016,ieeexplore.ieee.org
Android malware detection method based on naive Bayes and permission correlation algorithm,http://link.springer.com/article/10.1007/s10586-017-0981-6,http://link.springer.com/article/10.1007/s10586-017-0981-6,2017,Springer
A threat monitoring system in enterprise networks with smart mobiles,http://www.inderscienceonline.com/doi/abs/10.1504/IJSN.2016.075073,http://www.inderscienceonline.com/doi/abs/10.1504/IJSN.2016.075073,2016,inderscienceonline.com
App Store Analysis for Software Engineering,http://discovery.ucl.ac.uk/1537482/,http://discovery.ucl.ac.uk/1537482/1/App_Store_Analysis_Thesis_William_Martin.pdf,WJMartin,2017
Research Article Enhanced Permission Based Malware Detection in Mobile Devices Using Optimized Random Forest Classifier with PSO-GA,http://www.hermis-mp.org/jp_/issues/ijas2016/1/ijas-7.pdf,http://www.hermis-mp.org/jp_/issues/ijas2016/1/ijas-7.pdf,GPadmavathi,2016
Bio-inspired hybrid intelligent method for detecting android malware,http://link.springer.com/chapter/10.1007/978-3-319-27478-2_20,http://link.springer.com/chapter/10.1007/978-3-319-27478-2_20,2016,Springer
Malware propagation in fully connected networks: A netflow-based analysis,http://ieeexplore.ieee.org/abstract/document/7795376/,https://filebox.ece.vt.edu/~aviksg/latmal_milcom.pdf,2016,ieeexplore.ieee.org
A Study of Android Malware Detection Techniques and Machine Learning,http://ecommons.udayton.edu/maics/2016/Saturday/3/,http://ecommons.udayton.edu/cgi/viewcontent.cgi?article=1015&context=maics,ARalescu,2016
Android malware classification using parallelized machine learning methods,http://search.proquest.com/openview/3418a8286aa3bc1f55bc6fa6b5002295/1?pq-origsite=gscholar&cbl=18750&diss=y,https://udspace.udel.edu/bitstream/handle/19716/19893/2016_XuLifan_PhD.pdf?sequence=1&isAllowed=y,LXu,2016
Data Science for Software Maintenance,https://uwspace.uwaterloo.ca/handle/10012/11753,https://uwspace.uwaterloo.ca/bitstream/handle/10012/11753/Inozemtseva_Laura.pdf?sequence=3,LMMLInozemtseva,2017
Computational intelligence anti-malware framework for android OS,http://link.springer.com/article/10.1007/s40595-017-0095-3,http://link.springer.com/article/10.1007/s40595-017-0095-3,2017,Springer
AntiWare: An automated Android malware detection tool based on machine learning approach and official market metadata,http://ieeexplore.ieee.org/abstract/document/7777867/,http://ieeexplore.ieee.org/abstract/document/7777867/,2016,ieeexplore.ieee.org
